,title,artists,album,albumID,release_date,duration,spotifyID,popularity,isExplicit,acousticness,danceability,energy,instrumentalness,key,liveness,loudness,mode,speechiness,tempo,time_signature,valence,lyrics
38,92 Explorer,Post Malone,beerbongs & bentleys,6trNtQUgC8cgbWcqoMYkOR,2018-04-27,211426,1D2L6MefbXon28PzIk9I3r,72,True,0.265,0.798,0.733,1.25e-06,7,0.114,-4.811,0,0.0476,146.046,4,0.861,"Ooh-ooh, wow
Ahh, yeah-yeah (Wow)
Yeah-yeah, yeah-yeah, yeah-yeah
We got London On Da Track

Hunnid and twenty, come catch me
Forties inside of my belly
Shouldn't be drivin', I'm faded (Skrt, yeah)
Rock that Nirvana, my favorite
Damn, I forgot what her name is
She in the front seat, head-bangin' (Yeah, yeah)
Yeah, money counter sound somethin' like a chopper, chopper (Chopper, chopper)
Speaker system bumpin', fuck your fuckin' block up (Fuck your block up)
Used to mock him, now it's custom Bentley mock-ups (Mock-ups)
Killer drop, a call from lockup
If you buy that Echo, why you lyin'? You broke
Got a nine in my tote, get you smoked like a stoge
Keep on ridin' my coat, your new shit is a joke
Why you bitin' my flows? What you tryna be, Post?
Yeah

Ooh, baby, ooh, baby, guap keep expandin'
Ooh, yuck me up, I don't want no romancin'
Ooh, baby, I see these muhfuckas' glancin'
When my whip stop, then my wheels keep spinnin' (Skrt)
Ooh, baby, ooh, baby, guap keep expandin'
Ooh, yuck me up, I don't want no romancin'
Ooh, baby, I see these muhfuckas' glancin'
When my whip stop, then my wheels keep spinnin'

(Ooh)
She used to shoppin' at the mall (Ooh)
I'll teach lil baby how to ball
I hit Rodeo, spent like 40 G's (Wow)
Four hunnid pairs of Gucci socks (Socks)
I lost all my friends, made a lot of foes
Made a lot of M's, made a lot of moves
Open up the safe (Ooh), I'm just with the bros
Cop the 458, cost me 250 (Yeah)
Man, look at all my ice (Ice)
I hit your main thing twice (Your main thing twice)
Take a word of advice (A word of advice)
Break up with that ho (Ho)

Ooh, baby, ooh, baby, guap keep expandin'
Ooh, yuck me up, I don't want no romancin' (Ohh)
Ooh, baby, I see these muhfuckas' glancin' (Ahh)
When my whip stop, then my wheels keep spinnin' (Skrt)
Ooh, baby, ooh, baby, guap keep expandin' (Skrt)
Ooh, yuck me up, I don't want no romancin' (Skrt)
Ooh, baby, I see these muhfuckas' glancin'
When my whip stop, then my wheels keep spinnin'

Cold wrist frozen
Got sacks, Goldman
Bought the bar, Roseanne
No joke, deadpan

Ooh, baby, ooh, baby, guap keep expandin'
Ooh, yuck me up, I don't want no romancin'
Ooh, baby, I see these muhfuckas glancin'
When my whip stop, then my wheels keep spinnin' (Skrt, skrt)
Ooh, baby, ooh, baby, guap keep expandin' (Skrt)
Ooh, yuck me up, I don't want no romancin' (Skrt)
Ooh, baby, I see these muhfuckas glancin' (Skrt)
When my whip stop, then my wheels keep spinnin'

Ooh (Ooo-ooo)
Yeah, haha (Ooo-ooo)
Ooh (Ooo-ooo)
(Ooo-ooo)
We got London On Da Track"
39,Candy Paint,Post Malone,beerbongs & bentleys,6trNtQUgC8cgbWcqoMYkOR,2018-04-27,227533,32lItqlMi4LBhb4k0BaSaC,78,True,0.64,0.664,0.667,1.22e-06,4,0.0753,-5.941,1,0.154,180.064,4,0.381,"Yeah, yeah
Mmm, ayy

Candy paint with the white on top
Lambo doors are the oo-op drop
If you busy plottin' on what I got
Kick in your door, that's SWAT, you thot
Hundred thousand dollars on the table top
Half price my whip, same price my watch
Got no jumper, but I ball a lot
Bitch, I'm young Stoney, I do what I want
Candy paint with the white on top (Skrrt)
Lambo doors are the oo-op drop (Drop)
If you busy plottin' on what I got
Kick in your door, that's SWAT, you thot (Pop)
Hundred thousand dollars on the table top
Half price my whip, same price my watch (Bling)
Got no jumper, but I ball a lot (Swish)
Bitch, I'm young Stoney, I do what I want

Didn't know that was your girl when she gave me top (Yuh)
Kicked her out the Rolls said, ""Thanks a lot""
Goddamn, I love paper like I'm Michael Scott (Yeah)
I can do things that your man cannot (Yeah)
Slide boy comin' down, damn, I'm hot (Hot)
Everybody say that I gotta be stopped (Stopped)
Even though my final form ain't unlocked (Locked)
I'm so ahead of you muhfuckas'
How you comprehend what you ain't understandin'?
Count a hundred bands and I watch it vanish
Diamonds going crazy like they on the dance floor
Got a lot of ass, nothin' I can't handle

Flavor lasts forever, you should try a sample (Goddamn)
Baby, I'm the boss like I'm Tony Danza (Tony Danza)
Everybody tryna tell me what I stand for
But you don't fuckin' know me, homie, you don't want war (Ayy)

Candy paint with the white on top
Lambo doors are the oo-op drop
If you busy plottin' on what I got
Kick in your door, that's SWAT, you thot
Hundred thousand dollars on the table top
Half price my whip, same price my watch
Got no jumper, but I ball a lot (Ayy, ayy)
Bitch, I'm young Stoney, I do what I want (Ayy, ayy)
Candy paint with the white on top (Yeah)
Lambo doors are the oo-op drop (Drop, drop)
If you busy plottin' on what I got
Kick in your door, that's SWAT, you thot (Pop, pop, pop, pop)
Hundred thousand dollars on the table top (Woo)
Half price my whip, same price my watch (Yeah)
Got no jumper, but I ball a lot (Swish)
Bitch, I'm young Stoney, I do what I want

I've been rollin' twenty ash, hit the road (Woo)
Hit the switch up the suicide doors (Damn)
We already know you vanished though (Ooh)
Hit my momma when I ride in that, oh
All these muhfuckas' so false with me (Yah)
If your money funny, don't talk to me (Nah)
I know there ain't shit that you could offer me (No)
Take a second if you think about crossin' me

It lasts forever, you should try a sample (Goddamn)
Baby, I'm the boss like I'm Tony Danza (Tony Danza)
Everybody tryna tell me what I stand for (What I stand for)
But you don't fuckin' know me, homie, you don't want war (You don't want war)

Candy paint with the white on top
Lambo doors are the oo-op drop
If you busy plottin' on what I got
Kick in your door, that's SWAT, you thot
Hundred thousand dollars on the table top
Half price my whip, same price my watch
Got no jumper, but I ball a lot
Bitch, I'm young Stoney, I do what I want
Candy paint with the white on top
Lambo doors are the oo-op drop (Oh-ooh-ooh)
If you busy plottin' on what I got (Oh-ooh)
Kick in your door, that's SWAT, you thot
Hundred thousand dollars on the table top (Oh-ooh)
Half price my whip, same price my watch (Oh-ooh-ooh)
Got no jumper, but I ball a lot (Oh-ooh)
Bitch, I'm young Stoney, I do what I want"
40,Sugar Wraith,Post Malone,beerbongs & bentleys,6trNtQUgC8cgbWcqoMYkOR,2018-04-27,228146,0MrRAUcB8AZiB9ue2VOBYe,70,True,0.262,0.606,0.775,0.0,5,0.1,-4.269,0,0.0671,164.02,4,0.307,"I started with an eighth, alright (Alright)
And then I went and changed my life (My life)
I might take out the Wraith tonight (Tonight)
Put your arms around me, baby
I just want to fly, make it last before we die
And I know you want a ride
What's on your mind? What's on your mind?

And my '92 got doors like my Lambo
Spend my last paycheck on some ammo
We don't follow trends, rest in peace to Yamo
Your new shit sucks, I feel like Anthony Fantano (Ooh)
Sayin' I was broke last year, I can't go back there
Nicotine fiend, couldn't even buy a pack, yeah
She don't know my music, told her I ain't mad, yeah
Let her cut that coco on my platinum plaque, yeah (Wow)
Cut my fingers on my bands, oh yeah
Cut my locker with some Xan, oh yeah
Count me my guala in advance, oh yeah
Backstreet diamonds, watch them dance on ya, yeah

I started with an eighth, alright (Alright)
And then I went and changed my life (My life)
I might take out the Wraith tonight (Tonight)
Put your arms around me, baby
I just want to fly, make it last before we die
And I know you want a ride
What's on your mind? What's on your mind?

She don't want to spend all my dough
She gets paid to be a model (Model, model)
I take the lead, they just follow
Face it, you don't know what I know
Pull up, I got some' for ya
Somethin' in my trunk for ya
But I got a good lawyer
They always try to come for ya

I'ma pull up in that Bentley with the fuckin' windows tinted (Ooh)
'Pendin' how I'm feelin', take a drop of the extended (Skrt)
Think I'm showin' signs of slowin', homie, just forget it
I guess this what happens when you fuckin' handle business, yeah

I started with an eighth, alright (Alright)
And then I went and changed my life (My life)
I might take out the Wraith tonight (Tonight)
Put your arms around me, baby
I just want to fly, make it last before we die
And I know you want a ride
What's on your mind? What's on your mind?

I was broke last year, I can't go back there
I was broke last year, I can't go back there
Gasoline and I went and lit a match, yeah
Try to take the swagger, I know it for a fact, yeah

Pull up in that Bentley with the fuckin' windows tinted (Skrt)
'Pendin' how I'm feelin', take a drop of the extended (Skrt)
Think I'm showin' signs of slowin', homie, just forget it
I guess this what happens when you fuckin' handle business, yeah

I started with an eighth, alright (Alright)
And then I went and changed my life (My life)
I might take out the Wraith tonight (Tonight)
Put your arms around me, baby
I just want to fly, make it last before we die
And I know you want a ride
What's on your mind? What's on your mind?

I wanna fly, I wanna fly, yeah
I wanna fly, I wanna fly, yeah
I wanna fly
I wanna fly, I wanna fly, yeah"
41,Broken Whiskey Glass,Post Malone,Stoney (Deluxe),5s0rmjP8XOPhP6HhqOhuyC,2016-12-09,233813,5BoOzegGrg5XFRR8UBDtkF,63,True,0.289,0.512,0.673,3.04e-06,0,0.126,-7.359,1,0.0523,99.84,4,0.11,"I done drank codeine from a broken whiskey glass
I done popped my pills and I smoked my share of grass
Slaved for the man and I broke my fuckin' back
So you can take your nine-to-five and shove it up your ass
And that 101 like the highway in hell
Going too damn fast, I spilled drink on my Chanel
And I woke up and my room's fuckin' trashed like a damn hotel
And where I'm goin' next now? Only time will tell

Whoa-oh
Whoa-oh
Whoa-oh
Whoa-oh

I done spent some time chasin' women that don't give a shit
I done learned my lessons and I ain't never gon' forget
Started callin' this shit, started ballin' and shit, started flickin' that wrist
They ain't never listened, now I'm makin' them hits so I'm fuckin' your bitch (Ooh)
No, it ain't that difficult for me to forget that you ever exist
Bet you remember my name when I pull up in that whip that doesn't exist (Skrrt)
Spill lean on Supreme last Saturday
Let that shit splash, motherfucker talk saucey
Pass me them drugs, motherfucker let me try 'em
At the White House, call my homie Joe Biden, he flyin' out weed
Smokin' my dope, Bathing Ape, that be the clothe
Man, don't be silly, that shit you rockin' is old
Like it's years since you been to the store
Feel like Meek Milly but I ain't from Philly
I'm poppin' a wheelie, I show off my grillie
I do this for real-y and for my fam-ily
Same shit every night, man, it's all so famil'-y
The bitches they killin' me
Like, bitch, are you kiddin' me?
Ballin', that shit Jason Kiddin' me
You can't get rid of me
Yeah you want my chain and my chi bitch I’m real good at chemistry

Whoa-oh
Whoa-oh
Whoa-oh
Whoa-oh"
42,Big Lie,Post Malone,Stoney (Deluxe),5s0rmjP8XOPhP6HhqOhuyC,2016-12-09,207680,02opp1cycqiFNDpLd2o1J3,69,True,0.191,0.442,0.684,0.0,6,0.0725,-4.888,0,0.168,170.861,4,0.218,"I know, I know (I know, I know)
I know, I know (I know, I know)
Mustard on the beat, ho

Run it up, run it up (Run it up), count it up, count it up (Count it up)
'95 in my cup ('95 in my cup), nicotine in my blood
Go, run it, run it, count it, count it
Go, show me something, ayy, ayy
Go, talkin' that shit, keep on barkin' lil' bitch
Bitches tryna get lit, damn
Rosé poppin' with the Balmain on me
And I keep on callin' and they know that I don't answer my cell
No, I don't know your momma
I got so much commas, girl, you know I'm only into myself

Say you flexin', that's a big lie
When I pull up, give this bitch my life
And you know that I'ma get mine, yeah, yeah

Say you flexin', that's a big lie
When I pull up, give this bitch live
And you know that I'ma get mine, yeah, yeah (Yeah)
Say you flexin', that's a big lie
Say you got that shit you don't got
Heard you say that shit a hundred times, yeah, yeah (Yeah)

Say you flexin', that's a big lie
Say you flexin', that's a big lie
Say you flexin', that's a big lie
Say you flexin', that's a big lie

Ooh, valet the park on the whip
The Caddy, the '76
My woman gon' box on a bitch
They don't want no part in that shit
I got my money jumpin', I'm proud for ballin' on Fade
Didn’t watch the game, you can see that shit on replay
I just drop the top and I pull up to your party
I just grab a Bud and I pop the top on you, pour that water (Pour that water)

Say you flexin', that's a big lie
When I pull up, get this bitch live
And you know that I'ma get mine, yeah, yeah

Say you flexin', that's a big lie
When I pull up, get this bitch live
And you know that I'ma get mine, yeah, yeah (Yeah)
Say you flexin', that's a big lie
Say you got that shit you don't got
Heard you say that shit a hundred times, yeah, yeah (Yeah)

And they know who we are, yeah (Know who we are)
And they know that we ballin' (Know that we ballin')
When you wanna get this money
I don't want your bitch, just know it

Say you flexin', that's a big lie
When I pull up, get this bitch live
And you know that I'ma get mine, yeah, yeah (Yeah)

Say you flexin', that's a big lie
Say you got that shit you don't got
Heard you say that shit a hundred times, yeah, yeah (Yeah)

And they know who we are, yeah (Know who we are)
And they know that we ballin' (Know that we ballin')
When you wanna get this money
I don't want your bitch, just know it

I know, I know (I know, I know)
I know, I know (I know, I know)
I know, I know (I know, I know)
I know, I know (I know, I know)"
43,Deja Vu,Post Malone,Stoney (Deluxe),5s0rmjP8XOPhP6HhqOhuyC,2016-12-09,234213,0H8XeaJunhvpBdBFIYi6Sh,69,True,0.0931,0.62,0.69,0.0,7,0.131,-6.508,1,0.0493,133.935,4,0.331,"Oh-oh-oh
Ooh

'Cause I can't take it no more
No, you ain't like them bitches
Tell them hoes adios
And you can drop your panties
Leave them shits at the door
Dior falls on the floor
I swear we been here before
I'm tryna see you from my own perspective
You all in my section tryna come to my session
We rollin' up pressure, you know that we flexin'
We bought all the bottles, we came with the models
Girl this a confession, I'm not like your exes
I came up from Texas, and now that we textin'
You can fly in whenever, now you undressin'
Panties on the dresser, your hair gettin' messed up
The feelin' we catchin', my love is a blessin'
Made love in that Lexus, made love in that Lexus
I know you remember (I know you remember)

Tell me, is that déjà vu? (Ooh, ooh)
'Cause you want me and I want you (Ooh, ooh)
Tell me, is that déjà vu? (Ooh, ooh)
'Cause baby it ain't nothin' new, no
Tell me, is that déjà vu? (Ooh, ooh)
'Cause you want me and I want you (Ooh, ooh)
Tell me, is that déjà vu? (Ooh, ooh)
'Cause baby, this ain't nothin' new, no

Oh, you actin' reckless (Actin' reckless)
I told you that I need affection (Need affection)
So let me point you in the right direction (Right direction)
It's so important that you get the message (Ooh)
Yeah, yeah, I gotta say, gotta say somethin' to you, you, you
I'm on a roll, I'm gonna roll out in that new, new, new
If you wanna do what I wanna do
Well uhm-uhm-uhm
Well I guess that is just déjà vu

Tell me, is that déjà vu? (Ooh, ooh)
'Cause you want me and I want you (Ooh, ooh)
Tell me, is that déjà vu? (Ooh, ooh)
'Cause baby it ain't nothin' new, no
Tell me, is that déjà vu? (Ooh, ooh)
'Cause you want me and I want you (Ooh, ooh)
Tell me, is that déjà vu? (Ooh, ooh)
'Cause baby, this ain't nothin' new, no

Tell me if you want it, baby
'Cause I know I can drive you crazy
I just wanted you to know now
Oh-oh, oh-oh
Show up in that new Mercedes
You already know I'm faded
Girl, I've been thinkin' about you lately
Oh-oh, oh-oh

Tell me, is that déjà vu? (Ooh, ooh)
'Cause you want me and I want you (Ooh, ooh)
Tell me, is that déjà vu? (Ooh, ooh)
'Cause baby it ain't nothin' new, no
Tell me, is that déjà vu? (Ooh, ooh)
'Cause you want me and I want you (Ooh, ooh)
Tell me, is that déjà vu? (Ooh, ooh)
'Cause baby, this ain't nothin' new, no

'Cause I can't take it no more
No, you ain't like them bitches
Tell them hoes adios
And you can drop your panties
Leave them shits at the door
Dior falls on the floor
I swear we been here before"
44,No Option,Post Malone,Stoney (Deluxe),5s0rmjP8XOPhP6HhqOhuyC,2016-12-09,179826,6M0IsaUX4GNyto4niSegfI,71,True,0.0757,0.575,0.734,0.0,2,0.241,-4.949,1,0.057,83.986,4,0.494,"Ho, I look so clean and them motherfuckers just talkin'
Show up at the spot and now everyone, they all watchin'
Don't wanna prove you wrong but, shit, you leave me with no option, yeah, yeah

Everybody asking, “Post, when is the album droppin'?”
Ever since the very first day at it, I been poppin'
Don't wanna prove you wrong but shit, you leave me with no option, yeah, yeah
Ooh, swingin' in a four-door
Now they takin' photos
Bottles, we need more of those, ooh
Say she been to every show, yeah
Even on the road
And she always be in front row, ooh yeah
Everything that I worked for
Waited so long to get on
The Caddy just sits on the chrome
I swang through on dubs on the four

Baby, wanna get in this S-Class (S-Class)
Little mama, she just wanna go fast (Go fast)
You know, baby, you don't get a free pass (Free pass)
So I told her, “Ass, gas or grass”
Rolex with the diamonds keep me shinin'
Gotta have perfect timin' when I'm ridin'
Brand new Aston Martin with no mileage
Ooh, ooh, ooh, yeah

Ho, I'm so clean and them motherfuckers just talkin'
Show up at the spot and now everyone, they all watchin'
Don't wanna prove you wrong but shit, you leave me with no option, yeah, yeah (Ooh)

Now she hoppin' in a old-school
Swimmin' in the carpool
Everything is all cool, ooh
Yeah, she told me not to tell
'Bout the rumors that I heard
She said, “Everything was all true”, yeah

Baby, wanna get in this S-Class (S-Class)
Little mama, she just wanna go fast (Go fast)
You know, baby, you don't get a free pass (Free pass)
So I told her, “Ass, gas or grass”
Rolex with the diamonds keep me shinin'
Gotta have perfect timin' when I'm ridin'
Brand new Aston Martin with no mileage
Ooh, ooh, ooh, yeah

Just me and lil' mama, yeah
Ridin' around LA
Just me and lil' mama, yeah
We own the city, yeah

Baby, wanna get in this S-Class (S-Class)
Little mama, she just wanna go fast (Go fast)
You know baby you don't get a free pass (Free pass)
So I told her, “Ass, gas or grass”
Rolex with the diamonds keep me shining
Gotta have perfect timin' when I'm ridin'
Brand new Aston Martin with no mileage
Oh, oh

So come hop in that, ooh
What do you wanna do?
Put that dime in my coupe
With that gold on my tooth, oh yeah"
45,Cold,Post Malone,Stoney (Deluxe),5s0rmjP8XOPhP6HhqOhuyC,2016-12-09,268933,1QWmKmqhv5zcsS3v45FNl0,62,True,0.647,0.67,0.572,4.72e-06,4,0.104,-7.312,0,0.0415,132.98,4,0.259,"Good job, First

Yeah, my wrist so cold and my ice on froze
And it's all for you
Yeah, my ice so cold and my wrist on froze
Yeah it's all for you
Yeah, my wrist so cold and my ice on froze
Yeah, I'd die for you
Yeah, my ice so cold and my wrist on froze
Yeah, I'd die for you, oh-oh

Oh-oh-oh, oh-oh-oh, oh, yeah, yeah
Oh, yeah, yeah, yeah
I ain't runnin', runnin'

Yeah, stuntin', it's satisfyin' but it don't bring you closure
Diamonds my state of mind, I'm drownin' in the ocean
Just stay right where you are and don't come any closer
I'm just gon' handle mine and just maintain composure
People, they say learn from mistakes, yeah
You keep your space, yeah, but all this pain, yeah
You say you go away, yeah, stay in my lane though
You hurt so bad when you went away, yeah
I needed you, needed you
So what the fuck do I do?
I needed you, needed you
So what the fuck do I do? Yeah

Oh my God, oh my God
A lot of bullshit on my mind
Oh my God, oh my God
I think about you all the time
Oh my God, oh my God
And I don't care 'bout no money
Leave a knot up in my throat
Now I'm counting on my own

Yeah, my wrist so cold and my ice on froze
And it's all for you
Yeah, my ice so cold and my wrist so froze
Yeah it's all for you
Yeah, my wrist so cold and my ice on froze
Yeah, I'd die for you
Yeah, my ice so cold and my wrist on froze
Yeah, I'd die for you, oh-oh

My jewelry on, like an ice cube
And all I wanna do is just ignite you
This Saint Laurent, mama, you look nice too
Can't hold my tongue, don't got the heart to
Remember when I fell in love?
I just came up alone
Remember aim three, my fault
Told that bad bitch get on my VLONE
Hey, don't have much to do, yeah
Everything is ruined
Ayy, ain't no secret to it
Thrown the check like a Nike, I just do it

Oh my God, oh my God
A lot of bullshit on my mind
Oh my God, oh my God
I think about you all the time
Oh my God, oh my God
And I don't care 'bout no money
Leave a knot up in my throat
Now I'm counting on my own

Yeah, my wrist so cold and my ice on froze
And it's all for you
Yeah, my ice so cold and my wrist so froze
Yeah it's all for you

Oh-oh-oh, yeah, oh-oh-oh, yeah, oh-oh-oh, yeah, oh, yeah, yeah
Oh-oh-oh, yeah
I ain't runnin', runnin'
Oh-oh-oh, yeah, oh-oh-oh, yeah, oh-oh-oh, yeah, oh, yeah, yeah
Oh-oh-oh, yeah
I ain't runnin', runnin'
Ooh-ooh yeah"
46,White Iverson,Post Malone,Stoney (Deluxe),5s0rmjP8XOPhP6HhqOhuyC,2016-12-09,256533,6eT7xZZlB2mwyzJ2sUKG6w,78,True,0.233,0.675,0.562,0.0,7,0.0816,-7.678,1,0.0352,130.098,4,0.309,"Double OT
I'm a new three

Saucin', saucin', I'm saucin' on you
I'm swaggin', I'm swaggin', I'm swaggin', oh-ooh (Swaggin')
I'm ballin', I'm ballin', Iverson on you (Swish, ooh, ayy)
Watch out, watch out, watch out, yeah
That's my shot, that's my shot, that's my shot, yeah
Spendin', I'm spendin' all my fuckin' pay

I got me some braids and I got me some hoes
Started rockin' the sleeve, I can't ball with no Joes
You know how I do it, Concords on my toes
(This shit is hard), ooh
I ain't rich yet, but you know I ain't broke, I (I ain't broke, I)
So if I see it, I like it, buy that from the store, I (That from the store, I)
I'm with some white girls and they lovin' the coca (Coca)
Like they OT
Double OT like I'm KD, smokin' OG (Smokin' OG)
And you know me, in my 2-3s and my gold teeth (And my gold teeth)
Bitch, I'm smiling, bet you see me from the nosebleeds (Nosebleeds)
I'm a new three and I change out to my new 3s (To my new 3s)

White Iverson
When I started ballin', I was young
You gon' think about me when I'm gone
I need that money like the ring I never won, I won

Saucin', saucin', I'm saucin' on you
I'm swaggin', I'm swaggin', I'm swaggin', oh-ooh
I'm ballin', I'm ballin', Iverson on you (On you, on you)
Watch out, watch out, watch out, yeah
That's my shot, that's my shot, that's my shot, yeah
Spendin', I'm spendin' all my fuckin' pay

Ooh, Stoney
Cigarettes and a headband
Commas, commas in my head, man
Slumped over like a dead man
Red and black, 'bout my bread, man
I'm the answer, never question
Lace up, learn a lesson
Bitch, I'm saucin' (Wow), I do this often, don't do no talkin' (No)
My options right when I walk in, jump all them Jordans (Ooh)
I'm ballin', money jumpin'
Like I'm Davis from New Orleans
Or bitch I'm Harden, I don't miss nothin'
Fuck practice, this shit just happens, know y'all can't stand it (Ayy)
I have it, I never pass it, I work my magic
High average, ball on these bastards, it makes me happy
It's tragic, I make it happen, and all y'all Shaqtin'

White Iverson
When I started ballin' I was young
You gon' think about me when I'm gone
I need that money like the ring I never won, I won

Saucin', saucin', I'm saucin' on you
I'm swaggin', I'm swaggin', I'm swaggin', oh-ooh
I'm ballin', I'm ballin', Iverson on you
Watch out, watch out, watch out, yeah
That's my shot, that's my shot, that's my shot, yeah
Spendin', I'm spendin' all my fuckin' pay

Ooh-ooh
Ooh-ooh
Ooh-ooh
Ooh-ooh"
47,I Fall Apart,Post Malone,Stoney (Deluxe),5s0rmjP8XOPhP6HhqOhuyC,2016-12-09,223346,75ZvA4QfFiZvzhj2xkaWAh,83,True,0.0689,0.556,0.538,0.0,8,0.196,-5.408,0,0.0382,143.95,4,0.291,"Ooh, I fall apart
Ooh, yeah, mmm, yeah

She told me that I'm not enough (Yeah)
And she left me with a broken heart (Yeah)
She fooled me twice and it's all my fault (Yeah)
She cut too deep, now she left me scarred (Yeah)
Now there's so many thoughts goin' through my brain (Yeah)
And now I'm takin' these shots like it's Novocaine, yeah

Ooh, I fall apart
Down to my core
Ooh, I fall apart
Down to my core
Ooh, didn't know it before
Surprised when you caught me off guard
All this damn jewelry I bought
You was my shorty, I thought

Never caught a feelin' this hard
Harder than the liquor I pour
Tell me you don't want me no more
But I can't let go, everybody told me so
Feelin' like I sold my soul
Devil in the form of a whore
Devil in the form of a whore
You said it, no, you said it
No, you said that shit, we'd be together, oh

Ooh, I fall apart
Down to my core
Ooh, I fall apart
Down to my core
Ooh, didn't know it before
Surprised when you caught me off guard
All this damn jewelry I bought
You was my shorty, I thought

Ice keep pourin' and the drink keep flowin'
Try to brush it off, but it keep on goin'
Covered in scars and I can't help showin'
Whippin' in the foreign and the tears keep rollin'
Ice keep droppin' and the drink keep flowin'
Try to brush it off, but it keep on goin'
All these scars, can't help from showin'
Whippin' in the foreign and the tears keep blowin', yeah

Ooh, I fall apart
Down to my core
Ooh, I fall apart
Down to my core
Ooh, didn't know it before
Surprised when you caught me off guard
All this damn jewelry I bought
You was my shorty, I thought"
