,title,artists,album,albumID,release_date,duration,spotifyID,popularity,isExplicit,acousticness,danceability,energy,instrumentalness,key,liveness,loudness,mode,speechiness,tempo,time_signature,valence,lyrics
29,rockstar (feat. 21 Savage),Post Malone,beerbongs & bentleys,6trNtQUgC8cgbWcqoMYkOR,2018-04-27,218146,0e7ipj03S05BNilyu5bRzt,86,True,0.124,0.585,0.52,7.01e-05,5,0.131,-6.136,0,0.0712,159.801,4,0.129,"Hahahahaha
Tank God
Ayy, ayy

Sürtükleri becerip hap alıyorum
Adamım, kendimi rock yıldızı gibi hissediyorum
Kardeşlerimin otu sağlam
Ve Rasta gibi tüttürüyorlar
Benimle uğraş, Uzi'ni kap gel
Ortaya çık ve vurucularımla karşılaş
Dostlarım mahallene uğradığında o silahın gra-ta-ta-ta gibi patlayacağından emin olacaklar

Tarzımı değiştirdim, siyahlar içerisinde geldim
""Huzur içinde yat Bon Scott"" demeye başladım
Kapıyı kapat, tüttürüyoruz
Benden çakmak istedi beni Morrisson sanıyor (ayy)
Sahnede aptal gibi davran
Büyük ihtimalle şovumdan polis arabası ile ayrılacaksın
Efsaneviydi, Montage'ın tepesinden televizyonu aşağı fırlattı
Masanın üstünde Kokain var, likör karışıyor hiç bir şey umrumuzda değil
Dostum, kız arkadaşın bir sürtük içeri girmeye uğraşıyor
""Ben gruptanım"" diyor (ayy, ayy)
Kafayı yemiş gibi davranmaya başladı pantolonlarımdan tutmaya çalışıyor
Karavanımda yüz tane orospu var ve hiç birinin bir erkeği yok
Hepsi bir arkadaşını getirmiş

Sürtükleri becerip hap alıyorum
Adamım, kendimi rock yıldızı gibi hissediyorum
Kardeşlerimin otu sağlam
Ve Rasta gibi tüttürüyorlar
Benimle uğraş, Uzi'ni kap gel
Ortaya çık ve vurucularımla karşılaş
Dostlarım mahallene uğradığında o silahın gra-ta-ta-ta gibi patlayacağından emin olacaklar (pow, pow, pow)

Hills'de süperstarları beceriyordum
Popstar gibi hissediyorum (21,21,21)
Henny yudumluyorum fena orospular havuzuma atlıyor
Ve sütyenleri yok
Arkadan vur, saçlarından çek
""Yeter artık"" diye bağırıyor (evet, evet, evet)
""Savage, neden 12 tane garajın var ve 6 araban var?"" diye soruyorlar
İlişki aramıyorum, bunu nasıl buldun? (nasıl buldun?)
Karıcığın benim tam yalamalık olduğumu düşünüyor (yalamalık)
Yeşil yüzlükler kasamda, eski paralarım var (eski para)
LA sürtükleri her zaman ""Kokain nerde"" diye sorar (21,21)
Rock yıldızı gibi yaşa, polis arabasını parçala
Pop-Tart'dan daha tatlı, sert olmadığını biliyorsun
En yükseklere çıktım, hatırla sağlam traplerdim
Rock yıldızı gibi yaşa, Rock yıldızı gibi yaşıyorum (ayy)

Sürtükleri becerip hap alıyorum
Adamım, kendimi rock yıldızı gibi hissediyorum
Kardeşlerimin otu sağlam
Ve Rasta gibi tüttürüyorlar
Benimle uğraş, Uzi'ni kap gel
Ortaya çık ve vurucularımla karşılaş
Dostlarım mahallene uğradığında o silahın gra-ta-ta-ta gibi patlayacağından emin olacaklar (pow, pow, pow)

Yıldız, yıldız, Rock yıldızı, rock yıldızı, yıldız
Rock yıldızı
Aynı bir Rock yıldızı gibi hissediyorum"
30,Over Now,Post Malone,beerbongs & bentleys,6trNtQUgC8cgbWcqoMYkOR,2018-04-27,246986,09IOPhEh1OMe0HD9b36FJk,72,True,0.139,0.569,0.777,0.0,4,0.132,-4.041,0,0.0834,164.027,4,0.181,"Ahahah, yeah
(Yeah, yeah, yeah)

When you leave me, make me jump up off my roof
Didn't faze you, would've given you the moon
Even after everything that we've been through
I ain't never met nobody like you
Why you always tryna tell me that it's cool?
Need to quiet 'cause you never tell the truth
Felt like ballin' was the only thing to do
Trade my woman for some diamonds and a coupe

When she's comin' for my heart, it feels like Armageddon
I'ma turn the tables, promise you will not forget it
Won't apologize, don't give a fuck if you're offended
No discussion, yeah we gotta go our separate ways
Won't take me down in flames
I don't even wanna know your name
Watch how everything is gonna change, yeah, ayy

I'ma pull up in a Bentley
With a fuckin' hunnid thousand in my pocket, yeah, yeah
I'ma pull in, swang my door open
Stuntin', knowin' everybody watchin', yeah, yeah
And help another bitch out the whip
And I don't give a fuck if you don't like it, yeah, yeah
Just to show you that it's over
It don't matter what you gotta say about it, yeah
I'ma put that bitch pussy in a motherfuckin' bodybag
So you know that I'm never ever coming back
You kept your heart on the counter in a Prada bag
I used to never ever want to see the light of day, yeah
I was an idiot
Beggin' on my knees onto the floor
Now, I don't even want you anymore, anymore
It's over now
It's over now, yeah, yeah, yeah, ayy

Feels like a knife in my throat, you treat this like it's a joke
I bet you've done this before, I ain't surprised, yeah
I wasn't tryna let go, but you'll know why when I'm ghost
I hope you wind up alone, dead in my eyes, yeah
Ain't religious, only Christian when it's Dior
Only prayin' for the Amex and the gold
You ain't stop me, no, you only was a detour
Tried to drive me crazy, you ran out of road

When she's comin' for my heart, it feels like Armageddon
I'ma turn the tables, promise you will not forget it
Won't apologize, don't give a fuck if you're offended
No discussion, yeah we gotta go our separate ways
Won't take me down in flames
I don't even wanna know your name
Watch how everything is gonna change (Is gonna change), yeah, ayy

I'ma pull up in a Bentley
With a fuckin' hunnid thousand in my pocket, yeah, yeah
I'ma pull in, swang my door open
Stuntin', knowin' everybody watchin', yeah, yeah
And help another bitch out the whip
And I don't give a fuck if you don't like it, yeah, yeah (I don't give a fuck)
Just to show you that it's over
It don't matter what you gotta say about it, yeah (What you gotta say about it)
I'ma put that bitch pussy in a motherfuckin' bodybag (In a bodybag)
So you know that I'm never ever coming back (Never coming back)
You kept your heart on the counter in a Prada bag (In a Prada bag)
I used to never ever want to see the light of day, yeah
I was an idiot
Beggin' on my knees on to the floor (To the floor)
Now I don't even want you anymore, anymore
It's over now
It's over now
(It's over now)"
31,Psycho (feat. Ty Dolla $ign),Post Malone,beerbongs & bentleys,6trNtQUgC8cgbWcqoMYkOR,2018-04-27,221440,3swc6WTsr7rl9DqQKQA55C,81,True,0.546,0.75,0.56,0.0,8,0.111,-8.094,1,0.105,140.06,4,0.459,"Damn, my AP goin' psycho, lil' mama bad like Michael
Can't really trust nobody with all this jewelry on you
My roof look like a no-show, got diamonds by the boatload
Come with the Tony Romo for clowns and all the bozos
My AP goin' psycho, lil' mama bad like Michael
Can't really trust nobody with all this jewelry on you
My roof look like a no-show, got diamonds by the boatload
Don't act like you my friend when I'm rollin' through my ends, though

You stuck in the friend zone, I tell that four-five the fifth, ayy
Hunnid bands inside my shorts, DeChino the shit, ayy
Try to stuff it all in, but it don't even fit, ayy
Know that I been with the shits ever since a jit, ayy
I made my first million, I'm like, ""Shit, this is it,"" ayy
30 for a walkthrough, man, we had that bitch lit, ayy
Had so many bottles, gave ugly girl a sip
Out the window of the Benzo, we get seen in the rent'
And I'm like ""Whoa, man, my neck so goddamn cold”
Diamonds wet, my t-shirt soaked
I got homies, let it go, oh
My money thick, won't ever fold
She said, ""Can I have some to hold?""
And I can't ever tell you no

Damn, my AP goin' psycho, lil' mama bad like Michael
Can't really trust nobody with all this jewelry on you
My roof look like a no-show, got diamonds by the boatload
Come with the Tony Romo for clowns and all the bozos
My AP goin' psycho, lil' mama bad like Michael
Can't really trust nobody with all this jewelry on you
My roof look like a no-show, got diamonds by the boatload
Don't act like you my friend when I'm rollin' through my ends, though

The AP goin' psycho, my Rollie goin' brazy
I'm hittin' lil' mama, she wanna have my babies
It's fifty on the pinky, chain so stanky
You should see the whip, promise I can take yo' bitch
Dolla ridin' in an old school Chevy, it's a drop top
Boolin' with a thot-thot, she gon' give me top-top
Just one switch, I can make the ass drop (Hey)
Ayy, take you to the smoke shop
We gon' get high, ayy, we gon' hit Rodeo
Dial up Valentino, we gon' hit Pico
Take you where I'm from, take you to the slums
This ain't happen overnight, no, these diamonds real bright
Saint Laurent jeans, still in my Vans though
All VVS', put you in a necklace
Girl, you look beautiful tonight
Stars on the roof, they matching with the jewelry

Damn, my AP goin' psycho, lil' mama bad like Michael
Can't really trust nobody with all this jewelry on you
My roof look like a no-show, got diamonds by the boatload
Come with the Tony Romo for clowns and all the bozos
My AP goin' psycho, lil' mama bad like Michael
Can't really trust nobody with all this jewelry on you
My roof look like a no-show, got diamonds by the boatload
Don't act like you my friend when I'm rollin' through my ends, though"
32,Better Now,Post Malone,beerbongs & bentleys,6trNtQUgC8cgbWcqoMYkOR,2018-04-27,231266,7dt6x5M1jzdTEt8oCbisTK,84,True,0.331,0.68,0.578,0.0,10,0.135,-5.804,1,0.04,145.038,4,0.341,"You prolly think that you are better now, better now
You only say that 'cause I'm not around, not around
You know I never meant to let you down, let you down
Woulda gave you anything, woulda gave you everything
You know I say that I am better now, better now
I only say that 'cause you're not around, not around
You know I never meant to let you down, let you down
Woulda gave you anything, woulda gave you everything
Oh-oh

I did not believe that it would end, no
Everything came second to the Benzo
You're not even speakin' to my friends, no
You knew all my uncles and my aunts though
Twenty candles, blow 'em out and open your eyes
We were lookin' forward to the rest of our lives
Used to keep my picture posted by your bedside
Now it's in your dresser with the socks you don't like
And I'm rollin', rollin', rollin', rollin'
With my brothers like it's Jonas, Jonas
Drinkin' Henny and I'm tryna forget
But I can't get this shit outta my head

You prolly think that you are better now, better now
You only say that 'cause I'm not around, not around
You know I never meant to let you down, let you down
Woulda gave you anything, woulda gave you everything
You know I say that I am better now, better now
I only say that 'cause you're not around, not around
You know I never meant to let you down, let you down
Woulda gave you anything, woulda gave you everything
Oh-oh

I seen you with your other dude
He seemed like he was pretty cool
I was so broken over you
Life, it goes on, what can you do?
I just wonder what it's gonna take (What's it gonna take?)
Another foreign or a bigger chain (Bigger chain)
Because no matter how my life has changed
I keep on looking back on better days

You prolly think that you are better now, better now
You only say that 'cause I'm not around, not around
You know I never meant to let you down, let you down
Woulda gave you anything, woulda gave you everything
You know I say that I am better now, better now
I only say that 'cause you're not around, not around
You know I never meant to let you down, let you down
Woulda gave you anything, woulda gave you everything
Oh-oh

I promise
I swear to you, I'll be okay
You're only the love of my life (Love of my life)

You prolly think that you are better now, better now
You only say that 'cause I'm not around, not around
You know I never meant to let you down, let you down
Woulda gave you anything, woulda gave you everything
You know I say that I am better now, better now
I only say that 'cause you're not around, not around
You know I never meant to let you down, let you down
Woulda gave you anything, woulda gave you everything
Oh-oh"
33,Ball For Me (feat. Nicki Minaj),Post Malone,beerbongs & bentleys,6trNtQUgC8cgbWcqoMYkOR,2018-04-27,206266,6IaieqiCVvsNvEt6Y7yOFa,72,True,0.513,0.797,0.55,0.0,9,0.0786,-4.166,1,0.24,134.206,4,0.543,"Uh-uh-uh-uh-uh-uh, ball for me

Baby, could you? I got too much on my mind right now (Oh-oh-oh)
I ain't got the time to get you Saint Laurent now
Could you? I got too much on my mind right now (Oh-oh-oh)
Time to hit Rodeo, give my baby 30 thou'

Oo-oo-oo-oo-oo-oo-oo-oo-ooh, ball for me
Oo-oo-oo-oo-oo-oo-oo-oo-ooh, b-ball for me, yeah
Oo-oo-oo-oo-oo-oo-oo-oo-ooh, ball for me
Oo-oo-oo-oo-oo-oo-oo-oo-ooh, b-ball for me, yeah

I'm on the road, I'm gettin' paid, like what you want, baby? (What you want, baby?)
You're bougie, baby, but I love you, baby, give you the world, baby (You the world, baby)
Paid five grand for a handbag, that's Saint Laurent, baby (Saint Laurent, baby)
Damn, you love that money, baby (Oh-oh-oh)
Hunnid thousand plus hunnid thousand, my whip (My whip, my whip)
30 thousand plus 30 thousand, my wrist (My wrist, my wrist)
We got alcohol, plus bad bitches, that's lit (That's lit, that's lit)
I swear, baby, we was just kissin', that's it (That's it, that's it) (Oh-oh-oh)
How could I forget the shit that you done done for me? (For me)
Baby gonna take the charge and take the fall for me (For me)
Would love to take you shoppin', but girl, I'm in Europe tourin'
Sorry, lil' mama, I can't give you more

Baby, could you? I got too much on my mind right now (Oh-oh-oh)
I ain't got the time to get you Saint Laurent now
Could you? I got too much on my mind right now (Oh-oh-oh)
Time to hit Rodeo, give my baby 30 thou'

Oo-oo-oo-oo-oo-oo-oo-oo-ooh, ball for me
Oo-oo-oo-oo-oo-oo-oo-oo-ooh, b-ball for me, yeah
Oo-oo-oo-oo-oo-oo-oo-oo-ooh, ball for me
Oo-oo-oo-oo-oo-oo-oo-oo-ooh, b-ball for me, yeah

Yo, gotta hit him on the jack
When you comin' back? Where is you at on the map?
Everything is intact
Coulda been a seamstress, still wouldn't cut him slack
Pretty much, ain't got a clue
Itty bitty piggyback off everything I do
But I'm still droppin' jaws
Got 'em lookin' like James Harden at the awards (Oh-oh-oh)
Back to you, I'm so into you
For real, breh like I'm kin to you
If you a 10, I add 10 to you
They be mad when I tend to you
That's what the bae like
Call me Buffy 'cause that's what I slay like
These bitches, I son 'em like it's daylight
These niggas wanna know what it tastes like (Oh-oh-oh)
What it tastes like, yo, what it tastes like, yo
They wanna know what it tastes like, yo
All this ice, it should taste like snow
Get kimonos and let's fly to Tokyo
Pretty, pretty please baby, won't you cop this for me? (Uh)

Baby, could you? I got too much on my mind right now (Oh-oh-oh)
I ain't got the time to get you Saint Laurent now
Could you? I got too much on my mind right now (Oh-oh-oh)
Time to hit Rodeo, give my baby 30 thou'

Oo-oo-oo-oo-oo-oo-oo-oo-ooh, ball for me
Oo-oo-oo-oo-oo-oo-oo-oo-ooh, b-ball for me, yeah
Oo-oo-oo-oo-oo-oo-oo-oo-ooh, ball for me
Oo-oo-oo-oo-oo-oo-oo-oo-ooh, b-ball for me, yeah
Oo-oo-oo-oo-oo-oo-oo-oo-ooh, ball for me (What it tastes like)
Oo-oo-oo-oo-oo-oo-oo-oo-ooh, b-ball for me, yeah
Oo-oo-oo-oo-oo-oo-oo-oo-ooh, ball for me  (What it tastes like)
Oo-oo-oo-oo-oo-oo-oo-oo-ooh, b-ball for me, yeah"
34,Otherside,Post Malone,beerbongs & bentleys,6trNtQUgC8cgbWcqoMYkOR,2018-04-27,228226,4qWCFTuNnmGNdY4egtb4ZY,70,True,0.318,0.652,0.643,2.87e-06,9,0.208,-5.667,0,0.0353,104.932,4,0.109,"I been waitin', wide awake for the waves to come and take
Take me right to you
One hundred bottles of the good shit couldn't even bring you back
What am I to do?
Feel like I'm circlin' a drain, all I see is the remains of an ugly truth (Of an ugly truth)
One hundred models I could follow all the way to hell and back, but they can't replace you (They can't replace you)

Oh, oh, oh, ohh
Oh, oh, oh, ohh
Oh, oh, oh, ohh, ohh
Oh, oh, oh, ohh
Oh, oh, oh, ohh
Oh, oh, oh, ohh, ohh

I was puttin' on for you like a jersey
What I didn't know then couldn't hurt me
Never thought that you'd go and do me dirty
Left me in the cold, but on the inside I was burnin'
But that's just the way it goes
Wish that I could have control
Everybody dies alone
(And I ain't dead yet)

Say my prayers, but I lost faith a long time ago (A long time ago)
Dream nightmares
I guess we're gettin' used to losin' hope (Guess we're losing hope)
I don't even wonder why you don't answer when I call your name
Are you on the other side? Will you save us?
Or will you run away?

I'm still waitin', wide awake for the waves to come and take
Take me right to you (Take me right to you)
One hundred vials of denial, I know they won't bring you back
What am I to do? (What am I to do?)
You’re my alibi and motive when I'm lyin' to myself, what an ugly truth (What an ugly truth)
We’re no strangers to the flame
We will never be the same if we make it through (And we can make it through)

My back is up against the wall
But I used to feel invincible
Yeah, it was us against the world
But somehow, someway, the tables turned
I remember back then
Played my cards right you were my best hand
Still you keep me guessin'
Wonder if I'll ever get the message

Say my prayers, but I lost faith a long time ago (A long time ago)
Dream nightmares
I guess we're gettin' used to losin' hope (Guess we're losing hope)
I don't even wonder why you don't answer when I call your name
Are you on the other side? Will you save us?
Or will you run away?

Are you on the other side? Will you save us?
Or will you run away?"
35,Stay,Post Malone,beerbongs & bentleys,6trNtQUgC8cgbWcqoMYkOR,2018-04-27,204426,4H7WNRErSbONkM06blBoGc,77,True,0.449,0.507,0.48,0.0,5,0.147,-5.418,1,0.0266,86.046,4,0.35,"It's true that all that you know is all that you are
You said that it's all that you want and more
Fuck off and pour another drink
And tell me what you think
You know that I'm too drunk to talk right now
You put your cigarette out on my face
So beautiful, please, woman

Don't break your back for me
I'll put you out of your misery

Tell me that it's all okay (Tell me that it's all okay)
I've been waitin' on this all damn day (Waitin' on this all damn day)
Call me in the mornin', tell me how last night went
I'm here, but don't count on me to—

Stay a little longer if you convince me
And tell me all the things that you have against me
Every time we make up, the truth is fadin'
Everybody's blind when the view's amazin'
Damn, who are we right now?
Can we have a little conversation?
Figure it out with no intoxication
We carry on, what is our motivation?
We're never wrong, how the hell we gonna make it?
Maybe we're used to this
Tell me, what are we to do?
It's like we only play to lose
Chasin' pain with an excuse
I love that shit and so do you

But don't break your back for me
I'll put you out of your misery

Tell me that it's all okay (Tell me that it's all okay)
I've been waitin' on this all damn day (Waitin' on this all damn day)
Call me in the mornin', tell me how last night went
I'm here, but don't count on me to stay


Tell me that it's all okay (Tell me that it's all okay)
I've been waitin' on this all damn day (Waitin' on this all damn day)
Call me in the mornin', tell me how last night went
I'm here, but don't count on me to stay"
36,Blame It On Me,Post Malone,beerbongs & bentleys,6trNtQUgC8cgbWcqoMYkOR,2018-04-27,261800,1ZemPoaj7LBj1RAQrb89EC,70,False,0.145,0.652,0.591,5.65e-06,11,0.164,-7.274,0,0.0418,121.873,4,0.274,"I used to say I was free
Now all these people wanna keep on takin' pieces of me
They take away everything, had everything that I needed
They held me down, let me drown
They spit me out, right through the teeth
I can't pretend, ash in the wind, won't blow again
It was a breeze for you (Breeze for you)
These hurricanes inside of my brain, let it rain, made it look easy Can't look away, you love the pain, you love the pain

Watchin' me bleed
You cut me down on my knees
No matter what you believe
I think we both can agree

That you can't blame it on me (Ayy)
It's not my fault, it's not my fault, it's not my fault
Blame it on me (Ayy)
It's not my fault, it's not my fault, it's not my fault
I couldn't breathe
Almost lost myself, couldn't stop myself, I did it all
You can't blame it on me (Ayy)
It's not my fault, it's not my fault, it's not my fault

Every day's the same, yeah, I just watch 'em go
As I scrape away through the impossible
Yeah, I played the game but it was all for show
Tryna find my way, I nearly lost it though
Now I see dead people, most have no faith
Where did the time go? A watch with no face
They hit the ceilin', but my roof likes space
I took my chances so won't you

Blame it on me (Ayy)
It's not my fault, it's not my fault, it's not my fault
Blame it on me (Ayy)
It's not my fault, it's not my fault, it's not my fault
I couldn't breathe
Almost lost myself, couldn't stop myself, I did it all
You can't blame it on me (Ayy)
It's not my fault, it's not my fault, it's not my fault, not my fault

It's all my fault that I'm addicted to the clothes
It's all my fault, I paid the cost, yeah
It's all my fault that I ain't givin' up my soul
It's all my fault

Watchin' me bleed (Watchin' me bleed)
You cut me down on my knees (You cut me down on my knees)
No matter what you believe
I think we both can agree

That you can't blame it on me (Ayy)
It's not my fault, it's not my fault, it's not my fault
Blame it on me (Ayy)
It's not my fault, it's not my fault, it's not my fault
I couldn't breathe
Almost lost myself, couldn't stop myself, I did it all
You can't blame it on me (Ayy)
It's not my fault, it's not my fault, it's not my fault

It's not my fault, it's not my fault, it's not my fault
Blame it on me, yeah
It's not my fault, it's not my fault, it's not my fault"
37,Same Bitches (feat. G-Eazy & YG),Post Malone,beerbongs & bentleys,6trNtQUgC8cgbWcqoMYkOR,2018-04-27,212466,688QpQAwqsLdBR6lr13wK1,71,True,0.434,0.731,0.774,3.34e-06,10,0.114,-5.273,0,0.0555,100.005,4,0.219,"Yeah, yeah

I been in L.A. too long
How I see the same bitches everywhere I go?
It don't really matter where they from
Actin' or a model, heard it all before
Population four million, how I see the same bitches?
(How I see the same bitches?) Yeah, yeah
Population four million, how I see the same bitches?
(How I see the same bitches?) Yeah, yeah, yeah

I hit your DM, baby
Took the screenshot, yeah, you tried to play me
I bet this shit was good for your reputation
I just let it go, so I could see you naked
Holy moly, look at what you rolled in
Million followers, but your bumpers broken
What's your focus? Tell me what your goal is
I know you only like me
'Cause I just spent a hundred bands in one night
Spent a hundred bands in one night
I know you wanna live this life
But I can't make a ho a housewife (Oh, no)
What's your name? Who's your daddy?
Is he rich like me? Is he rich like me?
Yeah, yeah, yeah (Ayy)

I been in L.A. too long
How I see the same bitches everywhere I go?
It don't really matter where they from
Actin' or a model, heard it all before
Population four million, how I see the same bitches?
(How I see the same bitches?) (Uh, yeah)
Yeah, yeah
Population four million, how I see the same bitches?
(How I see the same bitches?) (Gerald)
Yeah, yeah, yeah (uh)

Everywhere I go I see the same ho
Always post selfies on the 'Gram from a angle, a Catfish
Hollywood devil, not a angel
Her bag is Chanel, but she drives a Durango
Yeah, and I'm gettin' to the queso
Woke and I'm hip to the game, so I'm thankful
OGs put me on tours, so I'm laced, bro
Real recognizin' that you don't speak the lingo
Clothes all new, not a wrinkle
Givin' you the game, gettin' sprinkled
Bottles on deck and my drink full
I turn into a beast, I'm a dog, I'm a pitbull
This life did it to me, I can't switch back
If I take her then you'll never get your bitch back
Yeah, the beat knockin', yeah, this shit clap
Welcome to the west it's where people gettin' rich at, ayy

I been in L.A. too long (G)
How I see the same bitches everywhere I go? (It's Eazy, you know?)
It don't really matter where they from (Yee, yee, yee)
Actin' or a model, heard it all before (Ayy)
Population four million, how I see the same bitches?
(West side nigga)
Population four million, how I see the same bitches?
(Hol' up, let me talk my shit, hol' up)
Yeah, yeah, yeah

I been in L.A. too long
Me and my bros hit the same hoes
L.A., Hollywood, that's some Valley hoes
Do I know how to fuck? They all know
Yeah, yeah, fuck it, go down baby, you ratchet
I'm with the program, baby (Yeah)
Word in the streets, you with the whole town, baby
I'm tryna do it for the brother like Motown, baby (For the record)
She fucked the L.A. Laker for the record
She fucked a Dodger baseball player for the record
She fucked the head of my record label, ooh
How you think she been so stable?
Ah, damn, ah, damn, but she down to fuck
Designer everything, Benz Truck
Pullin' up with you friend, tell me who she is
Oh, never mind, my friend fucked

Population four million, how I see the same bitches?
(How I see the same bitches?) Yeah, yeah, yeah
(Haha, oh, never mind, my friend fucked)
Population four million, how I see the same bitches?
(How I see the same bitches?) Yeah, yeah, yeah
(Haha, never mind, my friend fucked)
Population four million, how I see the same bitches?
(How I see the same bitches?) Yeah, yeah, yeah
Population four million, how I see the same bitches?
(How I see the same bitches?) Yeah, yeah, yeah"
